{"$schema":"http://json-schema.org/draft-07/schema#","$id":"https://hypercarrier.local/schemas/colorstack-rarebit-herdr-binding.json","title":"Closed Colorstack Rarebit-to-Herdr binding","type":"object","additionalProperties":false,"required":["schemaVersion","component","summaryTones","tokens"],"properties":{"schemaVersion":{"const":1},"component":{"const":"colorstack-rarebit-herdr-binding"},"summaryTones":{"type":"object","additionalProperties":false,"required":["diagnostic","muted","neutral"],"properties":{"diagnostic":{"const":"red"},"muted":{"const":"subtext0"},"neutral":{"const":"text"}}},"tokens":{"type":"object","additionalProperties":false,"required":["$rarebit_error","$rarebit_state_neutral","$rarebit_state_muted","$rarebit_state_diagnostic","$rarebit_user_age","$rarebit_stop_age"],"properties":{"$rarebit_error":{"const":"diagnostic"},"$rarebit_state_neutral":{"const":"neutral"},"$rarebit_state_muted":{"const":"muted"},"$rarebit_state_diagnostic":{"const":"diagnostic"},"$rarebit_user_age":{"const":"muted"},"$rarebit_stop_age":{"const":"muted"}}}}}
