{
  "schemaVersion": 1,
  "component": "colorstack-rarebit-herdr-binding",
  "summaryTones": {
    "diagnostic": "red",
    "muted": "subtext0",
    "neutral": "text"
  },
  "tokens": {
    "$rarebit_error": "diagnostic",
    "$rarebit_state_neutral": "neutral",
    "$rarebit_state_muted": "muted",
    "$rarebit_state_diagnostic": "diagnostic",
    "$rarebit_user_age": "muted",
    "$rarebit_stop_age": "muted"
  }
}
